nombre,fecha,descripcion,capacidad
Mrs,12/17/2025 04:54:09,felis eu sapien cursus vestibulum proin eu mi nulla ac enim in tempor turpis nec euismod scelerisque quam turpis adipiscing,470
Ms,4/12/2025 13:29:27,consequat ut nulla sed accumsan felis ut at dolor quis odio consequat varius integer ac,100
Rev,12/10/2025 20:17:43,dolor vel est donec odio justo sollicitudin ut suscipit a feugiat et eros vestibulum ac est lacinia,126
Honorable,4/22/2025 02:18:03,lectus vestibulum quam sapien varius ut blandit non interdum in ante vestibulum ante ipsum primis in faucibus,44
Rev,8/9/2025 08:43:12,quam sollicitudin vitae consectetuer eget rutrum at lorem integer tincidunt ante vel ipsum praesent blandit lacinia erat vestibulum,427
Mrs,6/10/2025 23:33:07,consequat morbi a ipsum integer a nibh in quis justo maecenas rhoncus aliquam lacus morbi quis tortor id nulla ultrices,491
Mr,4/19/2025 02:33:03,lacinia sapien quis libero nullam sit amet turpis elementum ligula vehicula consequat morbi a ipsum integer a,203
Dr,5/18/2025 12:40:36,imperdiet sapien urna pretium nisl ut volutpat sapien arcu sed augue aliquam erat volutpat in,440
Rev,10/29/2025 14:32:20,molestie hendrerit at vulputate vitae nisl aenean lectus pellentesque eget nunc donec quis orci eget orci vehicula,180
Ms,8/17/2025 05:38:04,mauris sit amet eros suspendisse accumsan tortor quis turpis sed ante vivamus tortor duis mattis egestas,363
